{
  "schema": "agent-output-policy/v1",
  "eligible_argv_rules": [
    {"reason_code": "pytest_direct", "argv_prefix": ["pytest"]},
    {"reason_code": "python_module_pytest", "argv_prefix": ["python", "-m", "pytest"]},
    {"reason_code": "ruff_check", "argv_prefix": ["ruff", "check"]},
    {"reason_code": "mypy", "argv_prefix": ["mypy"]},
    {"reason_code": "pyright", "argv_prefix": ["pyright"]},
    {"reason_code": "python_module_build", "argv_prefix": ["python", "-m", "build"]},
    {"reason_code": "npm_test", "argv_prefix": ["npm", "test"]},
    {"reason_code": "npm_run_test_script", "argv_prefix": ["npm", "run", "test"]},
    {"reason_code": "npm_run_test_unit_script", "argv_prefix": ["npm", "run", "test:unit"]},
    {"reason_code": "npm_run_lint_script", "argv_prefix": ["npm", "run", "lint"]},
    {"reason_code": "npm_run_typecheck_script", "argv_prefix": ["npm", "run", "typecheck"]},
    {"reason_code": "npm_run_build_script", "argv_prefix": ["npm", "run", "build"]},
    {"reason_code": "npm_run_verify_command", "argv_prefix": ["npm", "run", "verify"]},
    {"reason_code": "npm_run_verify_script", "argv_prefix": ["npm", "run", "verify:full"]},
    {"reason_code": "pnpm_test", "argv_prefix": ["pnpm", "test"]},
    {"reason_code": "yarn_test", "argv_prefix": ["yarn", "test"]},
    {"reason_code": "tsc_no_emit", "argv_prefix": ["tsc", "--noEmit"]},
    {"reason_code": "eslint", "argv_prefix": ["eslint"]},
    {"reason_code": "cargo_test", "argv_prefix": ["cargo", "test"]},
    {"reason_code": "cargo_build", "argv_prefix": ["cargo", "build"]},
    {"reason_code": "cargo_clippy", "argv_prefix": ["cargo", "clippy"]},
    {"reason_code": "go_test_all_packages", "argv_prefix": ["go", "test", "./..."]},
    {"reason_code": "go_test", "argv_prefix": ["go", "test"]},
    {"reason_code": "go_build", "argv_prefix": ["go", "build"]},
    {"reason_code": "pip_install_non_interactive", "argv_prefix": ["pip", "install", "--no-input"]},
    {"reason_code": "pip3_install_non_interactive", "argv_prefix": ["pip3", "install", "--no-input"]},
    {"reason_code": "python_pip_install_non_interactive", "argv_prefix": ["python", "-m", "pip", "install", "--no-input"]},
    {"reason_code": "python3_pip_install_non_interactive", "argv_prefix": ["python3", "-m", "pip", "install", "--no-input"]},
    {"reason_code": "go_install", "argv_prefix": ["go", "install"]}
  ],
  "negative_argv_rules": [
    {"reason_code": "file_read_cat", "argv_prefix": ["cat"]},
    {"reason_code": "file_read_sed", "argv_prefix": ["sed"]},
    {"reason_code": "file_read_head", "argv_prefix": ["head"]},
    {"reason_code": "streaming_tail", "argv_prefix": ["tail", "-f"]},
    {"reason_code": "file_read_tail", "argv_prefix": ["tail"]},
    {"reason_code": "search_rg", "argv_prefix": ["rg"]},
    {"reason_code": "search_grep", "argv_prefix": ["grep"]},
    {"reason_code": "search_find", "argv_prefix": ["find"]},
    {"reason_code": "git_diff", "argv_prefix": ["git", "diff"]},
    {"reason_code": "git_show", "argv_prefix": ["git", "show"]},
    {"reason_code": "git_log", "argv_prefix": ["git", "log"]},
    {"reason_code": "report_output_artifact", "argv_prefix": ["report"]},
    {"reason_code": "coverage_output_artifact", "argv_prefix": ["coverage"]},
    {"reason_code": "interactive_command", "argv_prefix": ["interactive"]},
    {"reason_code": "watch_command", "argv_prefix": ["watch"]},
    {"reason_code": "server_command", "argv_prefix": ["server"]},
    {"reason_code": "serve_command", "argv_prefix": ["serve"]},
    {"reason_code": "development_server", "argv_prefix": ["dev"]},
    {"reason_code": "cargo_watch", "argv_prefix": ["cargo", "watch"]},
    {"reason_code": "python_http_server", "argv_prefix": ["python", "-m", "http.server"]},
    {"reason_code": "npm_install", "argv_prefix": ["npm", "install"]},
    {"reason_code": "pnpm_install", "argv_prefix": ["pnpm", "install"]},
    {"reason_code": "yarn_install", "argv_prefix": ["yarn", "install"]},
    {"reason_code": "cargo_install", "argv_prefix": ["cargo", "install"]}
  ],
  "unsafe_shell_markers": [
    "|",
    ">",
    ">>",
    "<",
    "$(",
    "`",
    "&&",
    "||",
    ";",
    "&",
    "\n",
    "\r",
    "heredoc",
    "function"
  ],
  "result_handling": {
    "pass_reads_diagnostics": false,
    "automatic_retry": false,
    "raw_log_upload": false
  }
}
